_id,name,cuisines,address,locationRate,qualityRate,serviceRate,priceRate,spaceRate,avgRating,priceRange,timeOpen,Final_Score_Normalized,average_score,classification
67812ec1514dba6089ed91a0,Long Thủy - Bún Thái Hải Sản - Ngũ Xã,Món Việt,"24 Ngũ Xã, Quận Ba Đình, Hà Nội",7.1,6.9,6.2,6.4,7.0,6.72,50.000đ - 100.000đ,07:30 - 21:30,6.72,6.72,Neutral
67812ec1514dba6089ed9448,Bún Thái Cô Năm,Món Thái,"159/90/88 Trần Văn Đang, P. 11, Quận 3, TP. HCM",7.0,6.8,6.8,6.8,6.9,6.86,25.000đ - 45.000đ,08:00 - 19:00,6.578402366863906,6.719201183431953,Neutral
67812ec1514dba6089ed92fa,C'est Beau Coffee & Fashion,Món Việt,"174 Nguyễn Hữu Thọ, Tp. Bà Rịa, Vũng Tàu",6.4,6.4,6.3,6.3,6.4,6.36,15.000đ - 50.000đ,09:00 - 21:00,7.0626373626373615,6.711318681318681,Neutral
67812ec1514dba6089ed93e3,SaSin - Mì Cay 7 Cấp Độ Hàn Quốc - Hòa Bình,Món Hàn,"52C Hòa Bình, P. 5, Quận 11, TP. HCM",6.9,6.8,6.2,6.6,6.8,6.66,39.000đ - 79.000đ,09:00 - 22:00,6.748461538461537,6.704230769230769,Neutral
67812ec1514dba6089ed9429,Thành Đạt - Hủ Tiếu Nam Vang - Phạm Ngũ Lão,Món Việt,"239 Phạm Ngũ Lão, P. Phạm Ngũ Lão, Quận 1, TP. HCM",6.5,4.5,4.0,4.5,6.0,5.1,35.000đ - 50.000đ,00:01 - 23:59,8.303846153846154,6.701923076923077,Neutral
67812ec1514dba6089ed93ee,Sủi Cảo Thuận Phát - Hà Tôn Quyền,Món Việt,"164 Hà Tôn Quyền, P. 4, Quận 11, TP. HCM",6.4,6.3,5.7,5.9,6.4,6.14,30.000đ - 50.000đ,00:01 - 03:00 | 17:00 - 23:59,7.261923076923077,6.700961538461538,Neutral
67812ec1514dba6089ed926f,The Pizza Company - Đoàn Trần Nghiệp,Ý,"30 Đoàn Trần Nghiệp, P. Bùi Thị Xuân, Quận Hai Bà Trưng, Hà Nội",7.3,6.7,6.1,6.4,7.0,6.7,50.000đ - 220.000đ,10:00 - 22:00,6.7,6.7,Neutral
67812ec1514dba6089ed910d,Mì Chinh - Ngõ Hàng Bột,Hà Nội,"20 Ngõ Hàng Bột, P. Cát Linh, Quận Đống Đa, Hà Nội",7.4,6.6,6.1,6.6,6.8,6.7,20.000đ - 35.000đ,07:00 - 12:00,6.7,6.7,Neutral
67812ec1514dba6089ed9168,"Genko Chip - Gà Rán, Bánh Gà & Xôi Gà - Đại Cồ Việt",Món Á,"25 Đại Cồ Việt, Quận Hai Bà Trưng, Hà Nội",7.1,6.8,5.9,6.8,6.9,6.7,25.000đ - 300.000đ,09:30 - 21:00,6.7,6.7,Neutral
67812ec1514dba6089ed91c3,Nhà Hàng Gimbab - Bibimbab - Nguyễn Trãi,Món Hàn,"H1-3 Ngõ 445 Nguyễn Trãi, P. Thanh Xuân Nam, Quận Thanh Xuân, Hà Nội",7.1,6.7,6.4,6.4,6.9,6.7,100.000đ - 200.000đ,08:00 - 21:30,6.7,6.7,Neutral
67812ec1514dba6089ed93c6,Hải Sơn Ký - Mì Xào & Cơm Chiên - Nguyễn Đình Chính,Món Việt,"144A Nguyễn Đình Chính, P. 8, Quận Phú Nhuận, TP. HCM",7.0,6.7,5.7,6.7,6.7,6.56,20.000đ - 50.000đ,16:00 - 23:59,6.838461538461539,6.69923076923077,Neutral
67812ec1514dba6089ed9365,Baozi - Ẩm Thực Đài Loan - Hồ Tùng Mậu,Đài Loan,"79 Hồ Tùng Mậu, P. Bến Nghé, Quận 1, TP. HCM",7.0,6.4,5.5,6.3,6.6,6.36,42.000đ - 275.000đ,10:00 - 23:30,7.021794871794872,6.690897435897436,Neutral
67812ec1514dba6089ed914e,Xiem - Chè Thái Lan Cổ Truyền - Ngô Gia Tự,"Đài Loan, Món Thái","287 Ngô Gia Tự, P. Thượng Thanh, Quận Long Biên, Hà Nội",7.4,6.4,6.0,6.2,7.4,6.68,15.000đ - 45.000đ,08:00 - 23:00,6.68,6.68,Neutral
67812ec1514dba6089ed92a9,Lòng Rán Phố Hàng Gà,Món Việt,"16C Hàng Gà, Quận Hoàn Kiếm, Hà Nội",8.0,6.6,5.7,6.3,6.8,6.68,30.000đ - 66.000đ,19:30 - 22:30,6.68,6.68,Neutral
67812ec1514dba6089ed93b2,Phở Hoàng - Nguyễn Tri Phương,Món Việt,"460 Nguyễn Tri Phương, P. 9, Quận 10, TP. HCM",6.8,6.5,5.4,5.8,6.7,6.24,30.000đ - 66.000đ,07:00 - 14:00,7.11590909090909,6.677954545454545,Neutral
67812ec1514dba6089ed9251,Phở Thanh Hà - Lạc Trung,Món Việt,"236 - 238 Lạc Trung, Quận Hai Bà Trưng, Hà Nội",7.1,7.0,6.0,6.1,7.1,6.66,35.000đ - 55.000đ,06:00 - 23:00,6.66,6.66,Neutral
67812ec1514dba6089ed91e8,Bánh Su Kem Singapore Chewy Junior - Trung Hòa,Món Á,"59 Trung Hòa, P. Trung Hòa, Quận Cầu Giấy, Hà Nội",7.0,6.8,6.0,6.5,7.0,6.66,15.000đ - 250.000đ,08:00 - 21:30,6.66,6.66,Neutral
67812ec1514dba6089ed9237,Đại Lý Dừa - Khương Đình,Món Việt,"352 Khương Đình, Quận Thanh Xuân, Hà Nội",8.0,6.5,5.8,6.0,7.0,6.66,10.000đ - 100.000đ,09:00 - 22:30,6.66,6.66,Neutral
67812ec1514dba6089ed92f2,"Nam Nam Express - Món Việt, Thái & Mã","Món Việt, Món Á","Tầng Lobby, The Grand Ho Tram Strip, Xã Phước Thuận, Huyện Xuyên Mộc, Vũng Tàu",8.2,7.5,6.7,7.2,7.8,7.48,20.000đ - 8.000.000đ,06:00 - 23:00,5.805769230769231,6.642884615384616,Neutral
67812ec1514dba6089ed9159,Thiên Vương - Gà Mẹt & Gà Không Lối Thoát,Món Việt,"288 Thái Hà, Quận Đống Đa, Hà Nội",7.0,6.7,6.4,6.4,6.7,6.64,20.000đ - 300.000đ,10:00 - 13:30 | 16:15 - 21:30,6.64,6.64,Neutral
67812ec1514dba6089ed938e,Hà La Cà - Bánh Mì Bình Định & Bánh Cuốn Tây Sơn - Huỳnh Khương Ninh,empty,"20 Huỳnh Khương Ninh, P. Đa Kao, Quận 1, TP. HCM",5.0,5.0,5.0,5.0,5.0,5.0,Đang cập nhật,07:00 - 22:00,8.26923076923077,6.634615384615385,Neutral
67812ec1514dba6089ed946d,Hoàng Hôn - Lẩu Dê & Phở Bắc,Món Bắc,"Số 17 Kiệt 85 Nguyễn Huệ, P. Phú Nhuận, Tp. Huế, Huế",5.0,5.0,5.0,5.0,5.0,5.0,20.000đ - 110.000đ,07:00 - 21:30,8.26923076923077,6.634615384615385,Neutral
67812ec1514dba6089ed941f,Bún Gà 2 Tô & Bún Bò Huế - Quốc Lộ 13,Món Việt,"393 Quốc Lộ 13, P. Hiệp Bình Phước, Tp. Thủ Đức, TP. HCM",5.0,5.0,5.0,5.0,5.0,5.0,30.000đ - 30.000đ,06:00 - 21:00,8.26923076923077,6.634615384615385,Neutral
67812ec1514dba6089ed9284,Tư Mập - Cơm Tấm Sườn Cốt Lết Sài Gòn - Thụy Khuê,Món Việt,"241 Thụy Khuê, P. Thụy Khuê, Quận Tây Hồ, Hà Nội",6.8,6.7,6.4,6.5,6.7,6.62,30.000đ - 50.000đ,11:00 - 13:00 | 18:00 - 20:00,6.62,6.62,Neutral
67812ec1514dba6089ed9219,Bánh Đúc Nóng & Miến Trộn - Lê Ngọc Hân,Hà Nội,"8 Ngõ 8B Lê Ngọc Hân, Quận Hai Bà Trưng, Hà Nội",7.5,6.5,5.6,6.2,7.3,6.62,25.000đ - 30.000đ,08:00 - 21:00,6.62,6.62,Neutral
67812ec1514dba6089ed91b1,Bún Bò Huế O Uông,Món Huế,"546 Lạc Long Quân, Quận Tây Hồ, Hà Nội",6.8,6.8,6.0,6.6,6.8,6.6,20.000đ - 50.000đ,06:00 - 14:00 | 17:00 - 21:30,6.6,6.6,Neutral
67812ec1514dba6089ed91cf,Trà sữa LeeTee - Kem Trứng & Trà Hoa Quả - Nguyễn Phong Sắc,Món Á,"63 Nguyễn Phong Sắc, P. Dịch Vọng Hậu, Quận Cầu Giấy, Hà Nội",7.6,6.3,5.9,6.1,7.1,6.6,20.000đ - 55.000đ,08:00 - 23:00,6.6,6.6,Neutral
67812ec1514dba6089ed91ec,Quán Ngon Phố Cổ - Nguyễn Siêu,Món Việt,"Ngõ 28 Nguyễn Siêu, Quận Hoàn Kiếm, Hà Nội",8.7,6.0,4.7,5.3,8.3,6.6,30.000đ - 120.000đ,17:00 - 23:00,6.6,6.6,Neutral
67812ec1514dba6089ed91a3,76 Cafe - Nguyễn Hữu Huân,empty,"76 Nguyễn Hữu Huân, Quận Hoàn Kiếm, Hà Nội",8.0,6.0,6.0,6.0,7.0,6.6,20.000đ - 50.000đ,07:00 - 22:30,6.6,6.6,Neutral
67812ec1514dba6089ed925b,"Tiến Thiện - Mì Vằn Thắn, Hủ Tíu",Món Việt,"98 Trần Hưng Đạo, P. Cửa Nam, Quận Hoàn Kiếm, Hà Nội",7.2,6.7,5.8,6.5,6.8,6.6,30.000đ - 40.000đ,06:00 - 13:15,6.6,6.6,Neutral
67812ec1514dba6089ed90dc,Paparoti - Big C Thăng Long,Malaysia,"Tầng 1, Tầng 1, Ki Ốt 16, Big C Thăng Long, 222 Trần Duy Hưng (Cạnh Cổng Ra Xe Máy), Quận Cầu Giấy, Hà Nội",7.5,7.0,5.5,6.0,7.0,6.6,14.000đ - 14.000đ,08:00 - 22:00,6.6,6.6,Neutral
67812ec1514dba6089ed9189,Miến Lươn Lan Hương,Món Việt,"Nhà A1 TT. Nam Đồng Ngõ 119 Hồ Đắc Di, Quận Đống Đa, Hà Nội",7.4,6.6,5.8,6.5,6.7,6.6,20.000đ - 50.000đ,06:30 - 14:00,6.6,6.6,Neutral
67812ec1514dba6089ed92d0,Hương Chè Thái - Pasteur,Món Thái,"45 Pasteur, P. Hải Châu 1, Quận Hải Châu, Đà Nẵng",7.4,7.1,6.4,6.5,7.2,6.92,12.000đ - 28.000đ,08:00 - 22:00,6.269615384615384,6.5948076923076915,Neutral
67812ec1514dba6089ed91c5,Tuyết - Bún Chả 34,Hà Nội,"34 Hàng Than, Quận Ba Đình, Hà Nội",7.0,6.8,5.8,6.4,6.9,6.58,35.000đ - 55.000đ,07:00 - 17:00,6.58,6.58,Neutral
67812ec1514dba6089ed9205,Trâm - Bánh Mì Sốt Vang Đình Ngang,Món Việt,"30 Đình Ngang, P. Cửa Nam, Quận Hoàn Kiếm, Hà Nội",7.0,6.5,5.9,6.5,7.0,6.58,30.000đ - 66.000đ,08:00 - 23:00,6.58,6.58,Neutral
67812ec1514dba6089ed92b9,Thiền Tịnh - Cơm Chay,Món Việt,"25 Vũ Huy Tấn, P. 3, Quận Bình Thạnh, TP. HCM",7.2,6.6,6.3,6.4,6.8,6.66,20.000đ - 130.000đ,08:00 - 20:30,6.477884615384616,6.568942307692308,Neutral
67812ec1514dba6089ed942a,The Coffee Factory - Trương Định,Món Việt,"107A Trương Định, P. 6, Quận 3, TP. HCM",6.9,6.4,6.1,6.3,6.5,6.44,20.000đ - 50.000đ,06:30 - 22:30,6.697692307692308,6.568846153846154,Neutral
67812ec1514dba6089ed91ee,Lòng Rán Nhất Quán - Nguyễn Siêu,Món Việt,"23 Nguyễn Siêu, Quận Hoàn Kiếm, Hà Nội",7.0,6.4,6.3,6.3,6.8,6.56,50.000đ - 100.000đ,17:00 - 23:30,6.56,6.56,Neutral
67812ec1514dba6089ed920b,Bún Đậu Cây Đa Thuỵ Khuê Chính Hiệu - Quán Chuẩn,Món Việt,"235B Thụy Khuê, P. Thụy Khuê, Quận Tây Hồ, Hà Nội",6.7,6.6,6.2,6.6,6.7,6.56,30.000đ - 80.000đ,09:00 - 20:30,6.56,6.56,Neutral
67812ec1514dba6089ed9274,Lòng Trần Cháo - Tăng Bạt Hổ,Món Việt,"24 Tăng Bạt Hổ, P. Phạm Đình Hổ, Quận Hai Bà Trưng, Hà Nội",6.8,6.5,6.5,6.5,6.5,6.56,20.000đ - 300.000đ,10:00 - 22:00,6.56,6.56,Neutral
67812ec1514dba6089ed92a0,Lẩu Nấm Hoàng Gia - Toà Nhà CT5,Món Việt,"Toà Nhà CT5 Sông Đà, KDT Mỹ Đình, Quận Nam Từ Liêm, Hà Nội",7.0,6.5,6.3,6.3,6.7,6.56,50.000đ - 500.000đ,10:30 - 23:00,6.56,6.56,Neutral
67812ec1514dba6089ed92aa,Mì Gà Tần 24 - Hàng Bồ,Món Bắc,"24 Hàng Bồ, Quận Hoàn Kiếm, Hà Nội",7.2,6.5,5.7,6.5,6.8,6.54,40.000đ - 80.000đ,10:00 - 23:00,6.54,6.54,Neutral
67812ec1514dba6089ed9110,Quán Sành - Bò Mẹt & Lẩu Riêu Cua,Món Việt,"8 Ngõ 97 Phạm Ngọc Thạch, Quận Đống Đa, Hà Nội",6.7,6.5,6.4,6.5,6.6,6.54,60.000đ - 600.000đ,09:00 - 22:30,6.54,6.54,Neutral
67812ec1514dba6089ed929c,"Cóc, Sấu & Xoài Dầm - Shop Online",Món Việt,"55 Khương Trung, P. Khương Trung, Quận Thanh Xuân, Hà Nội",7.2,6.5,6.0,6.3,6.7,6.54,10.000đ - 100.000đ,09:00 - 21:00,6.54,6.54,Neutral
67812ec1514dba6089ed93d3,KATINAT - Đồng Khởi,Món Việt,"91 Đồng Khởi, P. Bến Nghé, Quận 1, TP. HCM",7.9,6.8,6.6,6.8,7.0,7.02,30.000đ - 100.000đ,09:00 - 20:15,6.020384615384616,6.520192307692308,Neutral
67812ec1514dba6089ed9154,Essence Cafe & Restaurant,Món Việt,"22 Tạ Hiện, Quận Hoàn Kiếm, Hà Nội",6.6,6.5,6.5,6.5,6.5,6.52,60.000đ - 132.000đ,empty,6.52,6.52,Neutral
67812ec1514dba6089ed9206,"Highlands Coffee - Trà, Cà Phê & Bánh - 18 Nguyễn Cơ Thạch",empty,"Kiosk A1-1 Tòa nhà A1, 18 Nguyễn Cơ Thạch, P. Cầu Diễn, Quận Nam Từ Liêm, Hà Nội",6.5,6.5,6.5,6.5,6.5,6.5,9.000đ - 65.000đ,07:00 - 23:00,6.5,6.5,Neutral
67812ec1514dba6089ed9244,Vịt Quay - Lò Đúc,Món Việt,"206 Lò Đúc, Quận Hai Bà Trưng, Hà Nội",6.7,6.5,6.3,6.4,6.6,6.5,50.000đ - 165.000đ,08:00 - 22:15,6.5,6.5,Neutral
67812ec1514dba6089ed91ea,Nộm Mai Nga - Hàm Long,Hà Nội,"25 Hàm Long, P. Hàng Bài, Quận Hoàn Kiếm, Hà Nội",7.1,6.5,5.9,6.3,6.7,6.5,20.000đ - 40.000đ,10:00 - 21:00,6.5,6.5,Neutral
67812ec1514dba6089ed93ed,Sủi Cảo Đại Nương,empty,"125 Châu Văn Liêm, P. 14, Quận 5, TP. HCM",6.7,6.5,6.0,6.1,6.6,6.38,40.000đ - 60.000đ,08:30 - 22:00,6.598461538461539,6.489230769230769,Neutral
67812ec1514dba6089ed9245,Trà Sữa Tocotoco - Hồ Gươm Plaza,Đài Loan,"Tầng 1, Tầng 1, Hồ Gươm Plaza, 110 Trần Phú, P. Mộ Lao, Quận Hà Đông, Hà Nội",6.8,6.5,6.1,6.4,6.6,6.48,25.000đ - 60.000đ,09:00 - 21:00,6.48,6.48,Neutral
67812ec1514dba6089ed9215,Nộm Lim - Phạm Hồng Thái,Món Việt,"17 Phạm Hồng Thái , Quận Ba Đình, Hà Nội",7.3,6.4,6.0,6.2,6.5,6.48,35.000đ - 500.000đ,16:00 - 20:00,6.48,6.48,Neutral
67812ec1514dba6089ed9370,Khánh Vy - Chè Mâm,Món Việt,"032 Lô H Chung Cư Ngô Gia Tự, P. 2, Quận 10, TP. HCM",7.5,6.6,5.8,6.4,7.0,6.66,5.000đ - 30.000đ,15:00 - 22:30,6.282307692307692,6.471153846153847,Neutral
67812ec1514dba6089ed9243,Ốc Oanh - Ăn Vặt Các Loại,Món Việt,"Ngõ 18 Hàm Long, P. Phan Chu Trinh, Quận Hoàn Kiếm, Hà Nội",7.3,6.3,6.0,6.0,6.7,6.46,15.000đ - 40.000đ,14:30 - 23:00,6.46,6.46,Neutral
67812ec1514dba6089ed90da,Bánh Xèo Nguyễn Công Trứ,Món Việt,"Chợ Nguyễn Công Trứ, Quận Hai Bà Trưng, Hà Nội",7.2,6.5,5.5,6.4,6.7,6.46,15.000đ - 30.000đ,06:00 - 22:00,6.46,6.46,Neutral
67812ec1514dba6089ed90fd,"Tuấn Anh - Bún, Bánh Đa Cá Rô",Món Việt,"35 Đặng Tiến Đông, Quận Đống Đa, Hà Nội",6.6,6.6,6.1,6.4,6.6,6.46,30.000đ - 50.000đ,07:00 - 22:00,6.46,6.46,Neutral
67812ec1514dba6089ed9309,Bánh Xèo Nhà Em,Món Việt,"215C, KP. Bình Hòa 2, TT. Tân Phước Khánh, Thị Xã Tân Uyên, Bình Dương",6.3,5.9,5.4,5.6,5.9,5.82,8.000đ - 220.000đ,06:00 - 21:00,7.075000000000001,6.447500000000001,Neutral
67812ec1514dba6089ed91fb,Koh Yam - Thai Kitchen & Dessert - Thái Hà,Món Thái,"330 Thái Hà, P. Láng Hạ, Quận Đống Đa, Hà Nội",7.0,6.5,5.9,6.2,6.6,6.44,30.000đ - 100.000đ,10:00 - 22:30,6.44,6.44,Neutral
67812ec1514dba6089ed91e9,Lotteria - Hồ Tây,Món Hàn,"2A Trấn Vũ, Quận Ba Đình, Hà Nội",7.7,6.3,5.4,6.1,6.7,6.44,30.000đ - 77.000đ,07:30 - 22:30,6.44,6.44,Neutral
67812ec1514dba6089ed91df,Lotteria - Minh Khai,Món Hàn,"Tầng 1, Tòa Nhà Hàn Việt, 203 Minh Khai, Quận Hai Bà Trưng, Hà Nội",7.4,6.5,5.4,6.1,6.8,6.44,30.000đ - 88.000đ,07:30 - 22:30,6.44,6.44,Neutral
67812ec1514dba6089ed91d5,Bít Tết 3 Hòe Nhai - Láng Hạ,Món Việt,"16/111 Láng Hạ, P. Láng Hạ, Quận Đống Đa, Hà Nội",7.2,6.5,5.9,6.0,6.6,6.44,40.000đ - 70.000đ,10:00 - 15:00 | 17:00 - 22:00,6.44,6.44,Neutral
67812ec1514dba6089ed92d5,Trà Sữa Ông Trùm,Món Việt,"73 Nguyễn Văn Thoại, Quận Sơn Trà, Đà Nẵng",6.9,6.5,5.9,6.2,6.7,6.44,10.000đ - 25.000đ,12:00 - 23:00,6.44,6.44,Neutral
67812ec1514dba6089ed923b,Balcony Bar - Lê Thái Tổ,Món Việt,"4 Lê Thái Tổ, P. Hàng Trống, Quận Hoàn Kiếm, Hà Nội",7.4,6.2,5.8,6.0,6.8,6.44,150.000đ - 550.000đ,16:00 - 22:00,6.44,6.44,Neutral
67812ec1514dba6089ed923e,O Hiền - Bún Bò Huế & Lẩu Đuôi Bò - Tô Hiệu,Món Huế,"106 C6 Tô Hiệu, P. Nghĩa Tân, Quận Cầu Giấy, Hà Nội",6.8,6.4,6.2,6.3,6.5,6.44,30.000đ - 55.000đ,06:30 - 21:30,6.44,6.44,Neutral
67812ec1514dba6089ed9197,Dê Ré Song Dương - Liễu Giai,Món Việt,"13 Liễu Giai, Quận Ba Đình, Hà Nội",7.8,6.8,4.8,5.7,7.0,6.42,50.000đ - 500.000đ,09:00 - 22:30,6.42,6.42,Neutral
67812ec1514dba6089ed9258,Bánh Mì Thịt Bò Xào - Ao Sen,Món Việt,"20 Ao Sen, Quận Hà Đông, Hà Nội",7.0,6.3,5.9,6.1,6.8,6.42,30.000đ - 50.000đ,06:00 - 20:00,6.42,6.42,Neutral
67812ec1514dba6089ed9385,Bà Quách - Hủ Tiếu Nam Vang,Món Việt,"50B Hoa Cau, P.7, Quận Phú Nhuận, TP. HCM",6.6,6.4,5.5,6.4,6.6,6.3,25.000đ - 45.000đ,06:00 - 21:00,6.512500000000001,6.40625,Neutral
67812ec1514dba6089ed90e5,Soup Cua Chị Bụi - Nguyễn Phúc Lai,Món Việt,"69B Nguyễn Phúc Lai, P. Ô Chợ Dừa, Quận Đống Đa, Hà Nội",6.7,6.4,5.9,6.3,6.7,6.4,15.000đ - 140.000đ,07:00 - 23:00,6.4,6.4,Neutral
67812ec1514dba6089ed91f6,Dũng Hạnh - Bánh Mì Giò Chả - Lê Đại Hành,Món Việt,"20 Lê Đại Hành, P. Lê Đại Hành, Quận Hai Bà Trưng, Hà Nội",6.8,6.5,6.0,6.0,6.7,6.4,20.000đ - 50.000đ,06:00 - 20:00,6.4,6.4,Neutral
67812ec1514dba6089ed936c,Mực 280 - Mực Một Nắng Chiên Nước Mắm,Món Việt,"278 Lê Văn Sỹ, P. 14, Quận 3, TP. HCM",7.0,6.1,6.0,6.0,6.9,6.4,80.000đ - 110.000đ,18:00 - 22:00,6.4,6.4,Neutral
67812ec1514dba6089ed923f,Trà Sữa Mixue - 122 Chùa Láng,Món Á,"122 Chùa Láng, P. Láng Thượng, Quận Đống Đa, Hà Nội",8.3,6.3,4.7,6.0,6.7,6.4,15.000đ - 25.000đ,09:00 - 22:00,6.4,6.4,Neutral
67812ec1514dba6089ed9250,Phở Thanh Hà - Minh Khai,Món Việt,"602 Minh Khai, Quận Hai Bà Trưng, Hà Nội",7.5,6.3,5.5,6.3,6.3,6.38,35.000đ - 55.000đ,empty,6.38,6.38,Neutral
67812ec1514dba6089ed922e,Bách Lộc - Phở Gà Ta - Trung Hòa,Món Việt,"108 Trung Hòa, Quận Cầu Giấy, Hà Nội",6.9,6.1,6.0,6.1,6.8,6.38,30.000đ - 70.000đ,06:00 - 14:00,6.38,6.38,Neutral
67812ec1514dba6089ed913d,Ốc Chị Lệ - Cửa Bắc,Món Việt,"88 Cửa Bắc, Quận Ba Đình, Hà Nội",7.1,6.3,5.7,6.0,6.8,6.38,15.000đ - 50.000đ,14:00 - 22:00,6.38,6.38,Neutral
67812ec1514dba6089ed9378,"Benno Bento - Mì Ý, Bò Mỹ, Cơm Bò Hầm - Nguyễn Trọng Tuyển",Ý,"220/19 Đường Nguyễn Trọng Tuyển, P. 8, Quận Phú Nhuận, TP. HCM",6.6,6.5,5.8,6.4,6.6,6.38,25.000đ - 95.000đ,08:30 - 19:20,6.38,6.38,Neutral
67812ec1514dba6089ed9162,"Hải Hói - Lẩu Vịt, Vịt Quay Áp Chảo",Món Việt,"55 Giang Văn Minh, P. Kim Mã, Quận Ba Đình, Hà Nội",7.2,6.3,6.0,6.0,6.4,6.38,50.000đ - 220.000đ,10:00 - 14:00 | 16:00 - 22:00,6.38,6.38,Neutral
67812ec1514dba6089ed93fe,Trà Sữa Star Tea - Trịnh Đình Trọng,Món Việt,"34 Trịnh Đình Trọng, P. Phú Trung, Quận Tân Phú, TP. HCM",7.6,6.5,5.5,6.1,7.5,6.64,10.000đ - 33.000đ,10:00 - 22:30,6.11775147928994,6.37887573964497,Neutral
67812ec1514dba6089ed9379,Bếp Nhà Má - Bún Mã Lai & Cơm Văn Phòng,Món Việt,"Tầng 1, Tầng 1, 220/14 Nguyễn Trọng Tuyển, P. 8, Quận Phú Nhuận, TP. HCM",7.5,7.5,5.5,6.0,7.5,6.8,10.000đ - 42.000đ,11:00 - 17:30,5.950000000000001,6.375,Neutral
67812ec1514dba6089ed939e,Chè Kỳ Đồng,Món Việt,"16C Kỳ Đồng, P. 9, Quận 3, TP. HCM",6.8,6.4,5.9,6.2,6.6,6.38,10.000đ - 22.000đ,09:00 - 22:00,6.359615384615386,6.369807692307693,Neutral
67812ec1514dba6089ed9409,Cháo Lòng 144,Món Việt,"144 Phan Đăng Lưu, P. 3, Quận Phú Nhuận, TP. HCM",6.6,6.2,5.8,5.9,6.2,6.14,15.000đ - 22.000đ,00:01 - 00:30 | 11:15 - 23:59,6.593846153846155,6.366923076923078,Neutral
67812ec1514dba6089ed9388,Hẻm Fast Food - Món Hàn Quốc - Nguyễn Cư Trinh,Món Việt,"75 Nguyễn Cư Trinh, P. Nguyễn Cư Trinh, Quận 1, TP. HCM",7.1,6.4,6.2,6.3,6.8,6.56,10.000đ - 100.000đ,11:00 - 21:00,6.161153846153846,6.360576923076923,Neutral
67812ec1514dba6089ed914c,"Minh Hiếu - Phở Gà, Xôi Gà & Cơm Gà",Món Việt,"Ki Ốt 9, Toà Nam Rice City, P. Hoàng Liệt, Quận Hoàng Mai, Hà Nội",7.3,6.5,5.0,6.0,7.0,6.36,25.000đ - 50.000đ,06:00 - 14:00 | 17:00 - 22:00,6.36,6.36,Neutral
67812ec1514dba6089ed929e,Nam Phương - Cơm Tấm Sài Gòn - Tạ Quang Bửu,Món Việt,"102 E6 Bách Khoa, Tạ Quang Bửu, Quận Hai Bà Trưng, Hà Nội",6.9,6.4,5.9,6.1,6.5,6.36,30.000đ - 55.000đ,10:00 - 22:00,6.36,6.36,Neutral
67812ec1514dba6089ed9417,Kimbap FC - Món Ăn Hàn Quốc,Món Hàn,"71/5 Điện Biên Phủ, P.15 , Quận Bình Thạnh, TP. HCM",6.9,6.1,6.0,6.0,6.4,6.28,25.000đ - 50.000đ,09:00 - 21:35,6.431153846153847,6.3555769230769235,Neutral
67812ec1514dba6089ed93ae,Ốc Cẩm - Ốc & Hải Sản - Trần Nhân Tôn,Món Việt,"162 Trần Nhân Tôn, P. 2, Quận 10, TP. HCM",6.6,6.0,5.6,5.8,6.3,6.06,30.000đ - 100.000đ,00:01 - 01:00 | 13:00 - 23:59,6.649230769230769,6.354615384615384,Neutral
67812ec1514dba6089ed93f8,Cơm Gà Hồng Phát - Hoàng Văn Thụ,"Món Việt, Món Trung Hoa","87 - 89 Hoàng Văn Thụ, P. 15, Quận Phú Nhuận, TP. HCM",6.6,6.2,5.8,5.9,6.3,6.16,25.000đ - 44.000đ,07:00 - 21:30,6.547692307692308,6.353846153846154,Neutral
67812ec1514dba6089ed948a,"Quán 8A Bình Dân - Cơm Phần, Canh Chua & Cá Kho Tộ",Món Việt,"33 Hoàng Hoa Thám, P. 3, Tp. Vũng Tàu, Vũng Tàu",6.3,6.0,5.7,5.8,6.3,6.02,25.000đ - 40.000đ,10:00 - 20:00,6.665384615384616,6.342692307692308,Neutral
67812ec1514dba6089ed912a,Trà Sữa House Of Cha - Trần Hữu Dực,Món Á,"9 Trần Hữu Dực Kéo Dài (Đối Diện ĐH Công Nghệ Đông Á), P. Xuân Phương, Quận Nam Từ Liêm, Hà Nội",6.7,6.3,6.0,6.0,6.7,6.34,20.000đ - 60.000đ,09:30 - 22:00,6.34,6.34,Neutral
67812ec1514dba6089ed9124,Miến Lươn Phúc - Lạc Trung,Món Việt,"152 Lạc Trung, Quận Hai Bà Trưng, Hà Nội",6.9,6.1,5.9,6.0,6.8,6.34,25.000đ - 55.000đ,07:00 - 22:00,6.34,6.34,Neutral
67812ec1514dba6089ed93f2,Bánh Mì PewPew - Út Tịch,Món Việt,"66 Út Tịch, P. 4, Quận Tân Bình, TP. HCM",6.7,6.7,6.5,6.7,6.7,6.66,20.000đ - 30.000đ,06:00 - 23:00,6.011153846153847,6.335576923076923,Neutral
67812ec1514dba6089ed942f,Mì Trộn Tên Lửa - Đường Số 21B,Món Việt,"31 Đường Số 21B, P. Bình Trị Đông B, Quận Bình Tân, TP. HCM",6.5,6.4,5.8,6.3,6.4,6.28,25.000đ - 65.000đ,09:30 - 21:00,6.376923076923077,6.328461538461539,Neutral
67812ec1514dba6089ed9136,Bún Ngan Nhàn - Ngõ Trung Yên,Món Việt,"14 Ngõ Trung Yên, Đinh Liệt, P. Hàng Bạc, Quận Hoàn Kiếm, Hà Nội",7.5,6.3,5.6,5.7,6.5,6.32,30.000đ - 50.000đ,06:30 - 13:30,6.32,6.32,Neutral
67812ec1514dba6089ed928c,Nhà Hàng 123 - Xã Đàn,Món Việt,"482 Xã Đàn, P. Nam Đồng, Quận Đống Đa, Hà Nội",6.8,6.2,5.7,6.1,6.8,6.32,60.000đ - 100.000đ,09:00 - 22:00,6.32,6.32,Neutral
67812ec1514dba6089ed9381,Cô Nhàn - Bánh Xèo Rau Rừng,Món Việt,"Hẻm 25 Giải Phóng, P. 4, Quận Tân Bình, TP. HCM",7.0,6.0,5.0,6.0,7.0,6.2,20.000đ - 40.000đ,11:00 - 19:00,6.434615384615384,6.317307692307692,Neutral
67812ec1514dba6089ed944c,Trà Sữa Tiên Hưởng - Lãnh Binh Thăng,Món Trung Hoa,"335 Lãnh Binh Thăng, Quận 11, TP. HCM",6.8,6.4,6.2,6.2,6.5,6.42,25.000đ - 40.000đ,08:30 - 22:00,6.181923076923076,6.300961538461538,Neutral
67812ec1514dba6089ed91d7,Gà Rán Popeyes - Sân Bài Nội Bài,Mỹ,"Sân Bay Nội Bài, Huyện Sóc Sơn, Hà Nội",7.7,6.7,4.8,5.3,7.0,6.3,60.000đ - 200.000đ,07:30 - 22:00,6.3,6.3,Neutral
67812ec1514dba6089ed91aa,Bánh Cuốn Nóng - Chợ Ngọc Hà,Món Việt,"Chợ Ngọc Hà, Quận Ba Đình, Hà Nội",8.0,6.5,4.5,5.5,7.0,6.3,10.000đ - 30.000đ,07:00 - 23:00,6.3,6.3,Neutral
67812ec1514dba6089ed93c1,Cô Thảo - Phá Lấu Bò,Món Việt,"243/29G Tôn Đản, P. 15, Quận 4, TP. HCM",7.1,6.3,5.6,5.8,6.5,6.26,10.000đ - 30.000đ,13:30 - 22:00,6.31576923076923,6.287884615384614,Neutral
67812ec1514dba6089ed93fc,Gà Rán KFC - Âu Cơ,Mỹ,"265 Âu Cơ, P. 5, Quận 11, TP. HCM",6.9,6.6,6.3,6.5,6.6,6.58,30.000đ - 88.000đ,09:00 - 22:00,5.993846153846154,6.2869230769230775,Neutral
67812ec1514dba6089ed92b8,Nhà Tôi Vegan - Nhà Hàng Thuần Chay,Món Việt,"124 Nguyễn Văn Thủ, P. Đa Kao, Quận 1, TP. HCM",6.2,5.9,5.4,5.6,6.2,5.86,10.000đ - 40.000đ,07:00 - 23:59,6.710384615384616,6.2851923076923075,Neutral
67812ec1514dba6089ed92da,Gà Rán KFC - Ngô Gia Tự,Mỹ,"1 - 3 Ngô Gia Tự, P. 2, Quận 10, TP. HCM",7.2,6.6,6.4,6.6,6.7,6.7,30.000đ - 88.000đ,09:00 - 22:00,5.859999999999999,6.279999999999999,Neutral
67812ec1514dba6089ed9360,Lệ Quy Nhơn - Bún Chả Cá,Món Miền Trung,"8 - 10 Đồng Nai, P. 15, Quận 10, TP. HCM",6.5,6.0,5.1,5.9,6.2,5.94,25.000đ - 77.000đ,06:00 - 22:00,6.614615384615385,6.2773076923076925,Neutral
67812ec1514dba6089ed9236,Cơm Viên - Đình Ngang,Món Việt,"11 Đình Ngang, P. Cửa Nam, Quận Hoàn Kiếm, Hà Nội",6.7,6.4,5.6,6.0,6.6,6.26,38.000đ - 75.000đ,10:30 - 23:00,6.26,6.26,Neutral
67812ec1514dba6089ed92ad,Bánh Mì Đông Ri,Món Việt,"55 Phạm Văn Chiêu, P. 14, Quận Gò Vấp, TP. HCM",7.5,7.5,5.0,5.5,7.5,6.6,15.000đ - 23.000đ,00:01 - 23:59,5.88076923076923,6.240384615384615,Neutral
67812ec1514dba6089ed917c,Paris Gâteaux - Bánh Ngọt & Trà Sữa - Discovery Complex,Quốc tế,"Discovery Complex, 302 Cầu Giấy, P. Dịch Vọng, Quận Cầu Giấy, Hà Nội",9.0,5.0,3.8,4.5,8.8,6.22,30.000đ - 450.000đ,09:00 - 22:00,6.22,6.22,Neutral
67812ec1514dba6089ed93d7,Cơm Thố Chuyên Ký,Món Trung Hoa,"67 Tôn Thất Đạm, P. Bến Nghé, Quận 1, TP. HCM",6.5,6.2,5.6,6.2,6.5,6.2,30.000đ - 100.000đ,11:00 - 22:00,6.2,6.2,Neutral
67812ec1514dba6089ed9175,Line Tea - Coffee & Juice - Vĩnh Ngọc,Món Việt,"Vĩnh Ngọc, Huyện Đông Anh, Hà Nội",8.0,6.0,4.0,5.0,8.0,6.2,20.000đ - 45.000đ,10:00 - 23:00,6.2,6.2,Neutral
67812ec1514dba6089ed93b5,Cơm Gà Ngon - Tô Vĩnh Diện,Món Việt,"15 Tô Vĩnh Diện, P. Linh Chiểu, Tp. Thủ Đức, TP. HCM",6.3,5.3,4.8,5.3,6.0,5.54,15.000đ - 30.000đ,09:00 - 21:00,6.838461538461539,6.18923076923077,Neutral
67812ec1514dba6089ed9490,"Bánh Khoai, Bánh Chuối - Chu Văn An",Món Việt,"12 Chu Văn An, P. Lê Lợi, Quận Ngô Quyền, Hải Phòng",8.0,6.0,4.0,5.0,7.0,6.0,4.000đ - 20.000đ,empty,6.365384615384615,6.1826923076923075,Neutral
67812ec1514dba6089ed947c,Quán Hải Sản Cô Thy 2 - Lê Hồng Phong Nối Dài,empty,"6 Lê Hồng Phong Nối Dài, P. Thắng Tam, Tp. Vũng Tàu, Vũng Tàu",7.5,7.0,5.5,5.5,7.0,6.5,20.000đ - 1.200.000đ,14:00 - 22:00,5.846153846153846,6.173076923076923,Neutral
67812ec1514dba6089ed9266,KOMBO - Cơm Niêu Singapore - Kim Đồng,Singapore,"26 Kim Đồng, P. Giáp Bát, Quận Hoàng Mai, Hà Nội",6.5,6.3,5.7,5.8,6.5,6.16,30.000đ - 100.000đ,09:00 - 21:00,6.16,6.16,Neutral
67812ec1514dba6089ed9121,Bún Riêu Cá Trường Sa - Vũ Hữu,Hà Nội,"273 Vũ Hữu, Quận Thanh Xuân, Hà Nội",6.7,6.1,5.7,5.9,6.4,6.16,25.000đ - 50.000đ,10:00 - 20:00,6.16,6.16,Neutral
67812ec1514dba6089ed9194,Anh Hòa French Bakery - Phùng Hưng,Pháp,"38 Phùng Hưng, P. Hàng Bông, Quận Hoàn Kiếm, Hà Nội",6.8,6.1,5.5,6.1,6.3,6.16,100.000đ - 550.000đ,Cả ngày,6.16,6.16,Neutral
67812ec1514dba6089ed935d,Quán Cô Ba - Đặc Sản Trảng Bàng,Miền Đông,"48 - 49 Lô R, Cư Xá Phú Lâm, P. 10, Quận 6, TP. HCM",6.7,5.9,5.7,5.8,6.0,6.02,2.000đ - 200.000đ,08:00 - 14:00 | 16:00 - 21:00,6.268461538461539,6.144230769230769,Neutral
