_id,name,cuisines,address,locationRate,qualityRate,serviceRate,priceRate,spaceRate,avgRating,priceRange,timeOpen,Final_Score_Normalized,average_score,classification
67812ec1514dba6089ed941e,Đông Nam Phát Mì Gia - Đinh Thị Thi,empty,"20A Đinh Thị Thi, P. Hiệp Bình Phước, Tp. Thủ Đức, TP. HCM",8.3,8.3,7.0,7.0,8.3,7.78,30.000đ - 60.000đ,06:00 - 13:00 | 16:00 - 21:00,7.276923076923077,7.5284615384615385,Positive
67812ec1514dba6089ed92a3,Bà Hằng - Bún Ngan & Bún Trộn,Món Việt,"Ki Ốt 3, Đối Diện Cổng Chợ Nghĩa Tân, P. Nghĩa Tân, Quận Cầu Giấy, Hà Nội",7.9,7.5,7.2,7.4,7.6,7.52,30.000đ - 35.000đ,09:00 - 23:00,7.52,7.52,Positive
67812ec1514dba6089ed924e,Trạm Sushi - Trấn Vũ,Món Nhật,"90 Trấn Vũ, P. Trúc Bạch, Quận Ba Đình, Hà Nội",8.2,7.6,6.9,7.2,7.7,7.52,8.000đ - 20.000đ,09:00 - 14:30 | 16:00 - 21:30,7.52,7.52,Positive
67812ec1514dba6089ed92d7,Mì Vịt Tiềm Thượng Hải 481,Món Việt,"481/1 Nguyễn Tri Phương, P. 8, Quận 10, TP. HCM",8.2,7.4,6.6,7.3,7.7,7.44,35.000đ - 40.000đ,15:00 - 22:00,7.591923076923076,7.515961538461538,Positive
67812ec1514dba6089ed93a8,Quán Nem Chợ Huyện - Đặc Sản Bình Định - Bạch Đằng,Bình Định,"100A Bạch Đằng, P. 2, Quận Tân Bình, TP. HCM",7.7,6.7,6.4,6.5,7.1,6.88,15.000đ - 145.000đ,10:00 - 22:30,8.136538461538462,7.508269230769232,Positive
67812ec1514dba6089ed93af,Su Bin - Cháo Ếch Singapore - Dương Bá Trạc,Singapore,"109/9 Dương Bá Trạc, P. 1, Quận 8, TP. HCM",7.7,7.0,6.3,6.8,7.3,7.02,10.000đ - 60.000đ,17:00 - 00:00,7.9923076923076914,7.506153846153845,Positive
67812ec1514dba6089ed90f1,Trà Sữa Feeling Tea - Hai Bà Trưng,Đài Loan,"53C Hai Bà Trưng, P. Trần Hưng Đạo, Quận Hoàn Kiếm, Hà Nội",8.0,7.3,7.2,7.3,7.7,7.5,20.000đ - 40.000đ,07:00 - 23:00,7.5,7.5,Positive
67812ec1514dba6089ed9142,Bánh Gà Bá Gành - Lương Định Của,Món Việt,"28B Lương Định Của (Đối Diện Ngõ 27 Lương Định Của), Quận Đống Đa, Hà Nội",8.3,7.5,6.9,7.2,7.6,7.5,30.000đ - 50.000đ,10:00 - 19:00,7.5,7.5,Positive
67812ec1514dba6089ed922d,Thu Nga - Kem Xôi & Chè Thái,Món Việt,"8 Hai Bà Trưng, P. Tràng Tiền, Quận Hoàn Kiếm, Hà Nội",8.2,7.3,7.2,7.2,7.6,7.5,25.000đ - 50.000đ,09:00 - 23:00,7.5,7.5,Positive
67812ec1514dba6089ed9103,Trâu Giật Kinh Bắc,Món Việt,"69 Đường 19-5, P. Văn Quán, Quận Hà Đông, Hà Nội",8.0,7.5,7.0,7.0,8.0,7.5,50.000đ - 300.000đ,08:00 - 23:00,7.5,7.5,Positive
67812ec1514dba6089ed9301,Cơm Tấm Sài Gòn - Quốc Lộ 13,Miền Đông,"392 Quốc Lộ 13, Thành Phố Thủ Dầu Một, Bình Dương",6.8,6.6,6.4,6.4,6.8,6.6,18.000đ - 28.000đ,Cả ngày | 07:00 - 21:00,8.373076923076923,7.486538461538461,Positive
67812ec1514dba6089ed9223,Azumaya 東屋 - Ẩm Thực Nhật Bản,Món Nhật,"16 Bùi Thị Xuân, P. Bùi Thị Xuân, Quận Hai Bà Trưng, Hà Nội",8.1,7.3,7.0,7.2,7.8,7.48,50.000đ - 150.000đ,06:30 - 14:00,7.48,7.48,Positive
67812ec1514dba6089ed944d,Đặc Sản Xứ Quảng - Mì Quảng & Bún Mắm,Món Miền Trung,"103/19 Nguyễn Trường Tộ, P. Vĩnh Ninh, Tp. Huế, Huế",7.8,7.6,6.9,7.3,7.8,7.48,7.000đ - 25.000đ,06:00 - 21:00,7.48,7.48,Positive
67812ec1514dba6089ed93c8,Hủ Tiếu Bò Viên 1122,Món Việt,"1000 Trường Sa , P. 12, Quận 3, TP. HCM",7.5,7.5,7.0,7.4,7.5,7.38,30.000đ - 40.000đ,16:00 - 22:00,7.552958579881656,7.466479289940828,Positive
67812ec1514dba6089ed921e,Bún Riêu Bề Bề - Cốm Vòng,Món Việt,"A19 Cốm Vòng (Đối Diện 10 Cốm Vòng), P. Dịch Vọng Hậu, Quận Cầu Giấy, Hà Nội",7.7,7.5,7.2,7.3,7.6,7.46,25.000đ - 150.000đ,06:00 - 14:30,7.46,7.46,Positive
67812ec1514dba6089ed91c4,Bún Bò Trộn Nam Bộ - Đường Láng,Món Việt,"61 Đường Láng, Quận Đống Đa, Hà Nội",7.9,7.4,6.9,7.4,7.7,7.46,35.000đ - 50.000đ,14:00 - 23:00,7.46,7.46,Positive
67812ec1514dba6089ed9283,Coffee House - Lê Văn Hưu,Món Việt,"4 Lê Văn Hưu, Quận Hoàn Kiếm, Hà Nội",8.0,7.3,6.7,7.3,8.0,7.46,15.000đ - 35.000đ,08:00 - 22:00,7.46,7.46,Positive
67812ec1514dba6089ed90f7,Delica Hans - Lotte Hotels & Resorts Hanoi - Lotte Center,Quốc tế,"Tầng Hầm 1, Tấng Hầm B1, Lotte Center, 54 Liễu Giai, Quận Ba Đình, Hà Nội",7.9,7.5,6.9,7.3,7.7,7.46,30.000đ - 250.000đ,08:00 - 22:00,7.46,7.46,Positive
67812ec1514dba6089ed91d6,TukTuk Thai Bistro - Triệu Việt Vương,Món Thái,"31 Triệu Việt Vương, P. Nguyễn Du, Quận Hai Bà Trưng, Hà Nội",7.8,7.4,7.1,7.4,7.6,7.46,100.000đ - 500.000đ,10:00 - 22:30,7.46,7.46,Positive
67812ec1514dba6089ed9362,Hokkaido Baked Cheese Tart - Phan Xích Long,Món Việt,"256 Phan Xích Long, P. 7, Quận Phú Nhuận, TP. HCM",7.7,6.9,6.5,6.5,7.5,7.02,39.000đ - 210.000đ,09:00 - 23:00,7.883136094674556,7.451568047337277,Positive
67812ec1514dba6089ed92be,Trà Sữa Maycha - Nguyễn Văn Nghi,Món Việt,"41 Nguyễn Văn Nghi, P. 4, Quận Gò Vấp, TP. HCM",7.7,7.4,7.1,7.1,7.4,7.34,12.000đ - 34.000đ,08:00 - 22:30,7.552692307692308,7.446346153846154,Positive
67812ec1514dba6089ed9419,Bánh Đúc Cô Phụng - Bánh Đúc - Phan Tây Hồ,Món Miền Nam,"28/20 Phan Tây Hồ, P. 7, Quận Phú Nhuận, TP. HCM",9.0,5.0,5.0,5.0,7.0,6.2,Đang cập nhật,07:00 - 18:00,8.684615384615384,7.442307692307692,Positive
67812ec1514dba6089ed91bc,Bà Thìn - Xôi Chè & Bánh Trôi - Bát Đàn,Món Việt,"1 Bát Đàn, Quận Hoàn Kiếm, Hà Nội",8.0,7.6,6.7,7.2,7.7,7.44,15.000đ - 25.000đ,07:30 - 23:00,7.44,7.44,Positive
67812ec1514dba6089ed9138,Vũ Thu Hằng - Mì Trộn Indomie & Đồ Ăn Vặt Online,Món Hàn,"9 Ngách 103B Ngõ Ga Hà Đông (Cuối Ngõ Rẽ Phải), P. Phú Lương, Quận Hà Đông, Hà Nội",8.2,7.4,6.4,7.4,7.8,7.44,25.000đ - 150.000đ,08:00 - 19:00,7.44,7.44,Positive
67812ec1514dba6089ed9187,Lee Hai Tea - Trà Sữa & Ăn Vặt - Lương Thế Vinh,Món Á,"107 Lương Thế Vinh, P. Thanh Xuân Bắc, Quận Thanh Xuân, Hà Nội",8.2,7.2,6.8,7.2,7.8,7.44,13.000đ - 25.000đ,09:00 - 23:00,7.44,7.44,Positive
67812ec1514dba6089ed916c,Bánh Mì P - Hàng Buồm,Món Việt,"12 Hàng Buồm, Quận Hoàn Kiếm, Hà Nội",8.1,7.5,6.5,7.4,7.6,7.42,15.000đ - 35.000đ,07:00 - 18:00,7.42,7.42,Positive
67812ec1514dba6089ed927a,Phở Thật,Hà Nội,"48 Trần Nhật Duật, P. Đồng Xuân, Quận Hoàn Kiếm, Hà Nội",7.9,7.5,6.7,7.2,7.8,7.42,25.000đ - 50.000đ,17:00 - 05:00,7.42,7.42,Positive
67812ec1514dba6089ed92c8,Bánh Mì One One - Xuân La,Hà Nội,"36 Xuân La, P. Xuân La, Quận Tây Hồ, Hà Nội",7.6,7.0,6.6,7.0,7.6,7.16,10.000đ - 30.000đ,06:00 - 21:30,7.666923076923076,7.413461538461538,Positive
67812ec1514dba6089ed91ae,Bánh Xèo Hương Phượng - Quan Nhân,Món Việt,"227 Quan Nhân, P. Nhân Chính, Quận Thanh Xuân, Hà Nội",8.0,7.0,7.0,7.0,8.0,7.4,15.000đ - 50.000đ,15:00 - 22:30,7.4,7.4,Positive
67812ec1514dba6089ed9119,Nem Lụi & Bánh Xèo - Nguyễn Khuyến,Món Quảng,"61 Nguyễn Khuyến, P. Văn Miếu, Quận Đống Đa, Hà Nội",8.3,7.3,6.2,7.2,8.0,7.4,5.000đ - 15.000đ,11:30 - 19:00,7.4,7.4,Positive
67812ec1514dba6089ed9115,Pizza Hut - Xã Đàn,Quốc tế,"159 Xã Đàn, P. Nam Đồng, Quận Đống Đa, Hà Nội",8.0,7.0,7.0,7.0,8.0,7.4,50.000đ - 300.000đ,10:00 - 22:00,7.4,7.4,Positive
67812ec1514dba6089ed91d4,Pizza Hut - The Manor,Món Âu,"Shop A003 The Manor Mễ Trì, P. Mễ Trì, Quận Nam Từ Liêm, Hà Nội",8.0,7.5,7.0,7.0,7.5,7.4,60.000đ - 220.000đ,10:00 - 22:00,7.4,7.4,Positive
67812ec1514dba6089ed91f5,Lan Trê - Bánh Đa Cua - Tân Ấp,Món Việt,"85 Ngõ 75 Tân Ấp, P. Phúc Xá, Quận Ba Đình, Hà Nội",9.0,7.0,6.0,7.0,8.0,7.4,20.000đ - 35.000đ,06:00 - 14:30,7.4,7.4,Positive
67812ec1514dba6089ed9330,Cẩm Ký - Cơm Gà Xối Mỡ,Món Việt,"37 Đề Thám, P. Tân An, Quận Ninh Kiều, Cần Thơ",7.3,7.0,6.6,6.6,7.3,6.96,50.000đ - 220.000đ,08:30 - 21:30,7.827307692307692,7.393653846153846,Positive
67812ec1514dba6089ed92ed,The FM$ - Trà Sữa & Sữa Tươi - 95 Ba Cu,Món Việt,"95 Ba Cu, P. 4, Tp. Vũng Tàu, Vũng Tàu",7.7,6.6,5.4,5.7,6.7,6.42,10.000đ - 20.000đ,09:00 - 20:00,8.357342657342656,7.388671328671328,Positive
67812ec1514dba6089ed9359,Starbucks Coffee - Cách Mạng Tháng 8,Mỹ,"241Bis Cách Mạng Tháng 8, P. 4, Quận 3, TP. HCM",7.6,7.2,6.4,7.2,7.4,7.16,40.000đ - 110.000đ,07:00 - 23:00,7.616153846153845,7.388076923076923,Positive
67812ec1514dba6089ed92c6,Bánh Mì Phố - Hàng Bài,Món Việt,"39A Hàng Bài, P. Hàng Bài, Quận Hoàn Kiếm, Hà Nội",7.8,7.5,7.3,7.4,7.6,7.52,25.000đ - 50.000đ,06:30 - 23:00,7.252692307692308,7.386346153846153,Positive
67812ec1514dba6089ed9329,Mỳ cay Itada - Nguyễn Văn Cừ,Món Hàn,"287 Nguyễn Văn Cừ, P. An Hòa, Quận Ninh Kiều, Cần Thơ",7.2,7.1,7.0,7.1,7.1,7.1,20.000đ - 50.000đ,08:00 - 23:00,7.664697802197803,7.382348901098901,Positive
67812ec1514dba6089ed91b2,Văn Miếu - Cà Phê & Nước Ép Trái Cây,Món Việt,"59C Quốc Tử Giám, P. Văn Chương, Quận Đống Đa, Hà Nội",7.8,7.4,6.6,7.4,7.7,7.38,15.000đ - 50.000đ,08:00 - 22:00,7.38,7.38,Positive
67812ec1514dba6089ed91db,Domino's Pizza - AEON Mall Long Biên,Mỹ,"27 Cổ Linh, Quận Long Biên, Hà Nội",7.6,7.5,7.0,7.3,7.5,7.38,49.000đ - 199.000đ,10:00 - 22:00,7.38,7.38,Positive
67812ec1514dba6089ed9116,Sushidokoro Yutaka - Ẩm Thực Nhật Bản,Món Nhật,"95 Xuân Diệu, P. Quảng An, Quận Tây Hồ, Hà Nội",8.5,7.4,6.3,7.3,7.4,7.38,100.000đ - 275.000đ,11:00 - 14:00 | 17:00 - 22:30,7.38,7.38,Positive
67812ec1514dba6089ed90f5,Bánh Đúc Nóng - Trung Tự,Hà Nội,"103 B5 Trung Tự (Ngõ 46C Phạm Ngọc Thạch), Quận Đống Đa, Hà Nội",8.2,7.4,6.5,6.8,7.9,7.36,15.000đ - 33.000đ,15:00 - 19:00,7.36,7.36,Positive
67812ec1514dba6089ed90e9,Bếp Nhà Vịt - Đồ Ăn Hàn Quốc,Món Hàn,"5 Ngõ 140/30/6 Đông Thiên, P. Vĩnh Hưng, Quận Hoàng Mai, Hà Nội",7.9,7.3,6.6,7.3,7.7,7.36,25.000đ - 60.000đ,10:00 - 17:00,7.36,7.36,Positive
67812ec1514dba6089ed92bf,Mầm Xanh - Ẩm Thực Chay,Món Việt,"46 Nguyễn Gia Trí, P. 25, Quận Bình Thạnh, TP. HCM",8.2,7.2,6.8,6.9,7.7,7.36,20.000đ - 30.000đ,07:00 - 15:00 | 16:00 - 21:00,7.36,7.36,Positive
67812ec1514dba6089ed93da,Min’s Estate - Bánh Bông Lan Đài Loan Le Castella,Món Việt,"151A Bạch Đằng, P. 2, Quận Tân Bình, TP. HCM",7.8,7.6,7.1,7.1,7.6,7.44,39.000đ - 149.000đ,08:30 - 21:00,7.265384615384615,7.352692307692308,Positive
67812ec1514dba6089ed91fc,Koh Yam - Thai Kitchen & Dessert - Giảng Võ,Món Thái,"122K1 Giảng Võ, Quận Đống Đa, Hà Nội",7.6,7.2,7.2,7.2,7.5,7.34,30.000đ - 150.000đ,09:00 - 22:30,7.34,7.34,Positive
67812ec1514dba6089ed91e5,Bếp Nhà Bun - Chân Gà Sả Ớt Online - Trường Chinh,Món Việt,"20 Ngõ 592 Trường Chinh, P. Khương Thượng, Quận Đống Đa, Hà Nội",7.7,7.4,6.9,7.3,7.4,7.34,90.000đ - 90.000đ,09:00 - 23:00,7.34,7.34,Positive
67812ec1514dba6089ed9248,"Al Fresco's - Pizza, Mỳ Ý, Sườn, Steak Bò Bít Tết - Vincom Center",Ý,"4th Floor, 402 Vincom Center, Quận Long Biên, Hà Nội",7.6,7.3,7.2,7.2,7.4,7.34,150.000đ - 330.000đ,10:00 - 22:00,7.34,7.34,Positive
67812ec1514dba6089ed92ea,Hotpot Story - Lotte Mart Vũng Tàu,Món Á,"Tầng 1 TTTM Lotte Mart Vũng Tàu, Đường 3 Tháng 2, P. 8, Tp. Vũng Tàu, Vũng Tàu",7.6,7.2,6.9,6.9,7.5,7.22,149.000đ - 319.000đ,10:00 - 22:00,7.453296703296703,7.336648351648352,Positive
67812ec1514dba6089ed93a9,Quán Của Má - Nem Nướng & Đặc Sản Nha Trang - Nguyễn Thị Nhỏ,Nha Trang,"61 Nguyễn Thị Nhỏ, P. 9, Quận Tân Bình, TP. HCM",7.6,7.4,7.0,7.3,7.4,7.34,30.000đ - 45.000đ,10:00 - 20:00,7.332142857142856,7.336071428571428,Positive
67812ec1514dba6089ed934d,Hoàng Hiếu - Các Món Gà,Món Việt,"222/3 Lâm Văn Bền, P. Tân Quy, Quận 7, TP. HCM",7.4,7.1,5.7,5.9,7.1,6.64,60.000đ - 330.000đ,10:00 - 23:00,8.02346153846154,7.33173076923077,Positive
67812ec1514dba6089ed93f5,Cơm Truyền Ký 2 - Trần Phú,Món Trung Hoa,"257A Trần Phú, P. 8, Quận 5, TP. HCM",7.1,6.6,6.1,6.4,7.0,6.64,30.000đ - 110.000đ,10:00 - 22:00,8.02,7.33,Positive
67812ec1514dba6089ed93c2,Vina Chuối - Huỳnh Thúc Kháng,Món Việt,"25 Huỳnh Thúc Kháng, P. Bến Nghé, Quận 1, TP. HCM",7.6,7.2,6.5,7.0,7.4,7.14,8.000đ - 8.000đ,09:00 - 20:00,7.514615384615384,7.327307692307691,Positive
67812ec1514dba6089ed93b3,KOI Thé - Nguyễn Tri Phương,Singapore,"266 Nguyễn Tri Phương, Quận 10, TP. HCM",7.6,7.2,6.7,7.1,7.2,7.16,30.000đ - 70.000đ,09:00 - 22:00,7.491538461538462,7.325769230769231,Positive
67812ec1514dba6089ed91d1,Trà Sữa Feeling Tea - Tân Mai,Đài Loan,"128 Tân Mai, P. Tân Mai, Quận Hoàng Mai, Hà Nội",8.2,7.2,6.7,7.1,7.4,7.32,12.000đ - 30.000đ,07:00 - 23:00,7.32,7.32,Positive
67812ec1514dba6089ed91a1,Xôi Sắn - Ngô Sĩ Liên,Món Việt,"40 Ngô Sĩ Liên, P. Văn Miếu , Quận Đống Đa, Hà Nội",8.0,7.3,6.3,7.2,7.8,7.32,10.000đ - 25.000đ,15:00 - 18:00,7.32,7.32,Positive
67812ec1514dba6089ed91e1,Lẩu Phan - Buffet Bò Úc - Láng Hạ,Món Việt,"16 Ngõ 59 Láng Hạ, Quận Đống Đa, Hà Nội",7.6,7.3,7.1,7.3,7.3,7.32,100.000đ - 150.000đ,10:00 - 22:00,7.32,7.32,Positive
67812ec1514dba6089ed9337,Bún Mắm & Lẩu Mắm 444 - Đường B5,empty,"Đường B5, KDC Phú Thịnh, P. Long Bình Tân, Thành Phố Biên Hòa, Đồng Nai",10.0,5.0,5.0,5.0,5.0,6.0,45.000đ - 150.000đ,07:00 - 23:00,8.615384615384615,7.3076923076923075,Positive
67812ec1514dba6089ed9341,"Hàu Nướng Tý Nguyễn - Trạm xăng dầu Cầu Mới, Tín Nghĩa Petroleum",empty,"Kế Bên Trạm Xăng dầu Cầu Mới ( Xe Bán Hàng Dán Màu Vàng, Xanh ), Tín Nghĩa Petroleum, Nguyễn Văn Trị, P. Hoà Bình, Thành Phố Biên Hòa, Đồng Nai",10.0,5.0,5.0,5.0,5.0,6.0,Đang cập nhật,15:00 - 23:00,8.615384615384615,7.3076923076923075,Positive
67812ec1514dba6089ed929b,Khoai Nướng & Ngô Luộc - Trần Bình,Món Việt,"9 Trần Bình, Quận Cầu Giấy, Hà Nội",7.5,7.5,7.0,7.0,7.5,7.3,5.000đ - 50.000đ,13:00 - 21:00,7.3,7.3,Positive
67812ec1514dba6089ed9450,Bún Bò Huế - Nguyễn Sinh Cung,Món Huế,"250 Nguyễn Sinh Cung, Tp. Huế, Huế",8.0,7.5,6.0,7.5,7.5,7.3,25.000đ - 30.000đ,06:30 - 21:00,7.3,7.3,Positive
67812ec1514dba6089ed926a,YakiSaki - Vietnam Izakaya,Món Nhật,"4 Xóm Hạ Hồi, P. Trần Hưng Đạo, Quận Hoàn Kiếm, Hà Nội",7.5,7.5,7.0,7.0,7.5,7.3,50.000đ - 200.000đ,10:00 - 23:59,7.3,7.3,Positive
67812ec1514dba6089ed943f,Chín - Bún Bò & Bún Thịt Nướng,Món Việt,"280 Nguyễn Sơn, Quận Tân Phú, TP. HCM",7.0,6.3,6.0,6.3,7.0,6.52,30.000đ - 45.000đ,07:00 - 11:00 | 16:00 - 20:00,8.05,7.285,Positive
67812ec1514dba6089ed9399,Starbucks Coffee - Emart,"Mỹ, Món Âu","Emart, 366 Phan Văn Trị, P. 5, Quận Gò Vấp, TP. HCM",7.6,7.5,6.2,7.4,7.6,7.26,35.000đ - 100.000đ,08:00 - 22:04,7.303461538461539,7.281730769230769,Positive
67812ec1514dba6089ed92c3,Phở 25 - Chi Nhánh Bình Tân,Món Việt,"40 - 41A Đường Số 4, P. Bình Trị Đông B, Quận Bình Tân, TP. HCM",8.1,7.5,6.2,6.6,8.0,7.28,10.000đ - 50.000đ,06:00 - 20:00,7.28,7.28,Positive
67812ec1514dba6089ed91cb,Cháo Trai - Trần Xuân Soạn,Món Việt,"26 Trần Xuân Soạn, Quận Hai Bà Trưng, Hà Nội",8.1,7.1,6.7,7.0,7.5,7.28,15.000đ - 28.000đ,11:00 - 13:00 | 15:00 - 20:30,7.28,7.28,Positive
67812ec1514dba6089ed91b7,Chicken Bros - Quán Gà Rán Hàn Quốc,Món Hàn,"552 Minh Khai, Quận Hai Bà Trưng, Hà Nội",8.1,7.5,6.2,7.0,7.6,7.28,80.000đ - 270.000đ,09:00 - 23:00,7.28,7.28,Positive
67812ec1514dba6089ed9217,Maru Korean - Tiệm Đồ Ăn Hàn Quốc & Trà Sữa - Trần Đại Nghĩa,empty,"133 Trần Đại Nghĩa, P. Bách Khoa, Quận Hai Bà Trưng, Hà Nội",7.8,7.2,6.8,6.8,7.8,7.28,20.000đ - 50.000đ,10:00 - 21:35,7.28,7.28,Positive
67812ec1514dba6089ed90f4,Top Of Hanoi - Lotte Hotels & Resorts Hanoi,"Món Việt, Quốc tế","Tầng 67, Lotte Center, 54 Liễu Giai, Quận Ba Đình, Hà Nội",8.0,7.2,6.3,6.9,8.0,7.28,100.000đ - 300.000đ,17:00 - 23:00,7.28,7.28,Positive
67812ec1514dba6089ed93ce,Bánh Mì 362 - Trần Cao Vân,Món Việt,"25 Trần Cao Vân, P. Đa Kao, Quận 1, TP. HCM",7.6,7.1,6.3,7.1,7.3,7.08,20.000đ - 30.000đ,06:00 - 22:00,7.464721485411141,7.272360742705571,Positive
67812ec1514dba6089ed9430,Phá Lấu Bò - Bà Hạt,Món Việt,"533 Bà Hạt, Quận 10, TP. HCM",7.5,7.0,6.1,6.9,7.1,6.92,18.000đ - 40.000đ,16:00 - 22:00,7.613846153846153,7.266923076923076,Positive
67812ec1514dba6089ed9256,Ốc Bự Hải Phòng - Chùa Láng,Món Việt,"Số 57 Ngõ 82 Chùa Láng, P. Láng Thượng, Quận Đống Đa, Hà Nội",7.5,7.5,6.8,7.0,7.5,7.26,20.000đ - 100.000đ,16:00 - 23:30,7.26,7.26,Positive
67812ec1514dba6089ed91bb,"Botanica - Salad, Steak & Pasta - Giảng Võ",Pháp,"116 D4 Giảng Võ, P. Giảng Võ, Quận Ba Đình, Hà Nội",7.7,7.3,6.8,7.0,7.5,7.26,40.000đ - 72.000đ,10:00 - 21:30,7.26,7.26,Positive
67812ec1514dba6089ed9270,Cơm Gà Hội An De Faifo - Triệu Việt Vương,Món Việt,"98 Triệu Việt Vương, P. Bùi Thị Xuân, Quận Hai Bà Trưng, Hà Nội",7.9,7.2,6.7,7.1,7.4,7.26,40.000đ - 490.000đ,07:00 - 21:30,7.26,7.26,Positive
67812ec1514dba6089ed9498,Bún Xì Dầu - Quách Văn Tuấn,Món Việt,"3 Quách Văn Tuấn, P. 12, Quận Tân Bình, TP. HCM",7.9,7.3,6.3,7.1,7.7,7.26,25.000đ - 30.000đ,empty,7.26,7.26,Positive
67812ec1514dba6089ed926d,Cơm Một Ngày Mới,Món Việt,"72 Mã Mây, Quận Hoàn Kiếm, Hà Nội",7.8,7.7,6.5,6.6,7.7,7.26,20.000đ - 110.000đ,10:30 - 21:30,7.26,7.26,Positive
67812ec1514dba6089ed93a4,Cơm 42,Món Việt,"42 Cô Bắc, Quận 1, TP. HCM",7.2,7.0,6.7,6.7,7.2,6.96,20.000đ - 55.000đ,10:00 - 19:00,7.5475,7.25375,Positive
67812ec1514dba6089ed93e5,Gà Nướng Muối Ớt - 31 Nguyễn Thượng Hiền,Món Việt,"31 Nguyễn Thượng Hiền, Quận 3, TP. HCM",7.8,7.3,6.0,7.3,7.3,7.14,149.000đ - 149.000đ,08:00 - 22:00,7.366923076923078,7.253461538461538,Positive
67812ec1514dba6089ed9314,GoGi House - Quán Nướng Hàn Quốc - AEON Mall Bình Dương,Món Hàn,"S5 Tầng 2 AEON Mall Bình Dương, 1 Đại Lộ Bình Dương, KP. Bình Giao, P. Thuận Giao, Thị Xã Thuận An, Bình Dương",7.8,7.5,7.1,7.4,7.6,7.48,100.000đ - 300.000đ,10:00 - 22:00,7.010384615384615,7.245192307692308,Positive
67812ec1514dba6089ed93f6,Cơm Chiên Da Gà & Xôi Gà,Món Việt,"23 Lô O (Đối Diện Cổng Chính Trường Nguyễn Huệ, Đường Hoàng Diệu), P. 8, Quận 4, TP. HCM",8.2,7.0,5.8,6.9,7.5,7.08,10.000đ - 15.000đ,10:00 - 13:00 | 16:00 - 20:00,7.403846153846154,7.241923076923078,Positive
67812ec1514dba6089ed9477,Gánh Bún Bò Mệ Kéo,Món Huế,"20 Bạch Đằng, Tp. Huế, Huế",7.3,6.8,6.5,6.8,7.3,6.94,25.000đ - 60.000đ,06:00 - 10:00,7.540485829959514,7.240242914979757,Positive
67812ec1514dba6089ed919e,Đức Long - Doner Kebab - Lương Ngọc Quyến,Thổ Nhĩ Kỳ,"5H Lương Ngọc Quyến, Quận Hoàn Kiếm, Hà Nội",7.9,7.3,6.5,7.1,7.4,7.24,15.000đ - 30.000đ,10:00 - 23:30,7.24,7.24,Positive
67812ec1514dba6089ed9152,Phở Tíu - Chợ Đồng Xuân,Món Việt,"Ngõ Chợ Đồng Xuân, Hàng Chiếu, P. Đồng Xuân, Quận Hoàn Kiếm, Hà Nội",8.3,7.1,5.9,7.1,7.8,7.24,25.000đ - 30.000đ,07:00 - 17:00,7.24,7.24,Positive
67812ec1514dba6089ed90fc,Chân Gà Hấp Sả Ớt Mắt To,Món Việt,"23 - 24 Lương Ngọc Quyến, Quận Hoàn Kiếm, Hà Nội",7.7,7.3,6.6,7.0,7.6,7.24,10.000đ - 200.000đ,10:30 - 22:30,7.24,7.24,Positive
67812ec1514dba6089ed918f,Phở 10 Lý Quốc Sư - Trần Cung,Hà Nội,"40 Trần Cung, P. Cổ Nhuế 1, Quận Bắc Từ Liêm, Hà Nội",7.9,7.5,6.3,6.9,7.6,7.24,30.000đ - 55.000đ,07:00 - 21:30,7.24,7.24,Positive
67812ec1514dba6089ed9267,Hoàng Mập - Mì Vằn Thắn & Sủi Cảo,Món Việt,"107E2 Thái Thịnh, Quận Đống Đa, Hà Nội",7.8,7.3,6.7,7.1,7.3,7.24,20.000đ - 33.000đ,06:30 - 22:30,7.24,7.24,Positive
67812ec1514dba6089ed911e,Nama Sushi - Vũ Phạm Hàm,Món Nhật,"42 Vũ Phạm Hàm, Quận Cầu Giấy, Hà Nội",8.0,7.2,6.4,7.0,7.6,7.24,50.000đ - 500.000đ,10:00 - 13:00 | 17:00 - 21:00,7.24,7.24,Positive
67812ec1514dba6089ed916d,Hoa Quả Dầm - Lê Thanh Nghị,Món Việt,"36 Lê Thanh Nghị, Quận Hai Bà Trưng, Hà Nội",8.2,7.4,6.2,6.3,8.1,7.24,20.000đ - 33.000đ,08:00 - 22:00,7.24,7.24,Positive
67812ec1514dba6089ed93fa,Sukiya - Cơm Bò Hầm & Mì Ramen - AEON Mall Bình Tân,Món Nhật,"Tầng 3, Tầng 3, Aeon Mall Bình Tân, 1 Đường Số 17A, P. Bình Trị Đông B, Quận Bình Tân, TP. HCM",7.5,7.4,7.3,7.4,7.4,7.4,15.000đ - 99.000đ,11:00 - 20:30,7.064615384615385,7.2323076923076925,Positive
67812ec1514dba6089ed91a6,Fresh Garden Bakery - Tô Hiệu,"Quốc tế, Hà Nội","183 Tô Hiệu, Quận Cầu Giấy, Hà Nội",7.9,7.1,6.8,6.8,7.5,7.22,20.000đ - 400.000đ,06:30 - 21:00,7.22,7.22,Positive
67812ec1514dba6089ed91ca,Phở Cuốn Hương Mai - 25 Ngũ Xã,Hà Nội,"25 Ngũ Xã, Quận Ba Đình, Hà Nội",7.6,7.2,6.9,7.0,7.4,7.22,30.000đ - 44.000đ,09:00 - 22:00,7.22,7.22,Positive
67812ec1514dba6089ed9222,Gumiho - Quán Nhậu Cho Các Nàng,Món Hàn,"133 Bùi Thị Xuân, Quận Hai Bà Trưng, Hà Nội",7.5,7.4,6.7,7.1,7.4,7.22,50.000đ - 500.000đ,11:00 - 14:30 | 17:00 - 23:59,7.22,7.22,Positive
67812ec1514dba6089ed917b,Paris Gâteaux - Bánh Ngọt & Trà Sữa - The Garden,Quốc tế,"The Garden, Mễ Trì, Quận Nam Từ Liêm, Hà Nội",7.6,7.3,6.5,7.2,7.4,7.2,10.000đ - 450.000đ,06:30 - 23:15,7.2,7.2,Positive
67812ec1514dba6089ed91b4,"Thành Biển - Bún Bề Bề, Cơm Rang Hải Sản & Bún Chả Nem Cua Bể",Món Bắc,"251 Thụy Khuê, P. Thụy Khuê, Quận Tây Hồ, Hà Nội",8.0,7.0,7.0,7.0,7.0,7.2,30.000đ - 60.000đ,06:00 - 13:00,7.2,7.2,Positive
67812ec1514dba6089ed92ab,Phở Hồng - Phở Gà,Món Việt,"15 Hàng Hòm, P. Hàng Gai, Quận Hoàn Kiếm, Hà Nội",7.6,7.5,6.3,7.1,7.5,7.2,25.000đ - 33.000đ,06:00 - 23:00,7.2,7.2,Positive
67812ec1514dba6089ed9181,Anh Hoa - Vịt Quay Bắc Kinh,Món Việt,"171 Tô Hiệu, P. Hà Cầu, Quận Hà Đông, Hà Nội",9.0,7.0,5.0,6.0,9.0,7.2,10.000đ - 300.000đ,10:00 - 23:59,7.2,7.2,Positive
67812ec1514dba6089ed915c,Gà Rán KFC - Bà Triệu,Mỹ,"292 Bà Triệu, Quận Hai Bà Trưng, Hà Nội",7.5,7.1,7.0,7.0,7.4,7.2,50.000đ - 110.000đ,09:00 - 22:00,7.2,7.2,Positive
67812ec1514dba6089ed918e,Bún Chả - Chợ Xanh Định Công,Hà Nội,"Ki Ốt 23 Chợ Xanh Định Công, P. Định Công, Quận Hoàng Mai, Hà Nội",8.0,7.2,6.0,7.2,7.6,7.2,25.000đ - 50.000đ,10:00 - 14:00,7.2,7.2,Positive
67812ec1514dba6089ed9199,Minh Đức - Gà Tươi - Nam Từ Liêm,Món Việt,"29 Nguyễn Hoàng, P. Mỹ Đình 2, Quận Nam Từ Liêm, Hà Nội",8.0,7.0,7.0,7.0,7.0,7.2,100.000đ - 300.000đ,10:00 - 22:00,7.2,7.2,Positive
67812ec1514dba6089ed9108,Cơm Gà Bon Bon,Món Việt,"19 Ngõ 22 Phố Lụa, P. Vạn Phúc, Quận Hà Đông, Hà Nội",8.5,8.0,5.0,6.5,8.0,7.2,10.000đ - 60.000đ,10:00 - 22:00,7.2,7.2,Positive
67812ec1514dba6089ed9135,Bà Vượng - Bún Chả Nem Cua Bể - Ngô Sĩ Liên,Món Bắc,"29 Ngõ Ngô Sĩ Liên, Ngô Sĩ Liên, Quận Đống Đa, Hà Nội",8.0,7.0,7.0,7.0,7.0,7.2,10.000đ - 50.000đ,07:00 - 14:00,7.2,7.2,Positive
67812ec1514dba6089ed944e,Bánh Kem Hưng Thịnh,Món Việt,"100 Thạch Hãn, P. Thuận Hòa, Tp. Huế, Huế",10.0,8.0,5.0,5.0,8.0,7.2,70.000đ - 350.000đ,07:00 - 22:00,7.2,7.2,Positive
67812ec1514dba6089ed9164,Chè Bốn Mùa - Hàng Cân,Món Việt,"4 Hàng Cân, P. Hàng Cân, Quận Hoàn Kiếm, Hà Nội",7.6,7.2,6.8,7.0,7.4,7.2,15.000đ - 22.000đ,09:00 - 22:00,7.2,7.2,Positive
67812ec1514dba6089ed945a,Bún Trộn Mệ Già,Món Huế,"Cạnh Số 5 Trần Quang Khải, Tp. Huế, Huế",7.0,5.5,5.0,5.0,6.5,5.8,8.000đ - 10.000đ,13:00 - 17:00,8.546153846153846,7.173076923076923,Positive
67812ec1514dba6089ed9229,Lượng Béo - Bún Ốc Gia Truyền,Món Việt,"12 Ngõ 12 Đào Tấn, P. Cống Vị, Quận Ba Đình, Hà Nội",7.4,7.2,6.9,7.0,7.3,7.16,25.000đ - 30.000đ,06:00 - 21:00,7.16,7.16,Positive
67812ec1514dba6089ed9158,The Booklink Cafe - Đọc Sách Và Thưởng Thức Cafe,Món Việt,"Bếp 4, Chợ Sinh Viên, ĐH Nông Nghiệp, Huyện Gia Lâm, Hà Nội",8.3,7.0,6.6,6.8,7.1,7.16,20.000đ - 55.000đ,08:00 - 22:00,7.16,7.16,Positive
67812ec1514dba6089ed9178,Hà Trang - Ốc Nóng,Hà Nội,"1 Đinh Liệt, P. Hàng Đào, Quận Hoàn Kiếm, Hà Nội",8.2,7.1,6.3,6.5,7.7,7.16,50.000đ - 110.000đ,17:00 - 20:00,7.16,7.16,Positive
67812ec1514dba6089ed9307,Xôi Khang & Xôi Xéo Hà Nội,Hà Nội,"86A Đường 30 Tháng 4, P. Phú Hòa, Thành Phố Thủ Dầu Một, Bình Dương",7.8,7.4,6.4,6.8,7.4,7.16,12.000đ - 22.000đ,05:30 - 11:30 | 15:00 - 21:30,7.16,7.16,Positive
67812ec1514dba6089ed9235,Lẩu Ếch Hà My,Hà Nội,"70 Ngõ 36 Giang Văn Minh, Quận Ba Đình, Hà Nội",7.7,7.3,6.7,6.8,7.3,7.16,50.000đ - 110.000đ,09:00 - 22:00,7.16,7.16,Positive
67812ec1514dba6089ed90ef,Nam An Quán - Ẩm Thực Huế,Món Huế,"56 Nguyên Hồng, P. Láng Hạ, Quận Đống Đa, Hà Nội",7.5,7.3,6.6,7.0,7.4,7.16,25.000đ - 39.000đ,07:00 - 21:30,7.16,7.16,Positive
67812ec1514dba6089ed91d8,Gà Rán Popeyes - TTTM D2 Giảng Võ,empty,"Tầng 1, TTTM D2 Giảng Võ, P. Giảng Võ, Quận Ba Đình, Hà Nội",7.5,7.1,7.0,7.0,7.2,7.16,3.000đ - 200.000đ,10:00 - 22:00,7.16,7.16,Positive
67812ec1514dba6089ed91c8,Minh Vũ - Đồ Ăn Hàn Quốc Online,Món Hàn,"9 Ngõ 3/14 Nhân Hòa, P. Thanh Xuân Trung, Quận Thanh Xuân, Hà Nội",7.3,7.3,6.8,7.1,7.3,7.16,30.000đ - 80.000đ,09:00 - 22:00,7.16,7.16,Positive
